{
  "formatVersion": 1,
  "catalogId": "effect-workflow-builder-bpmn-2.0.2",
  "catalogRevision": 8,
  "implementation": "@effect/workflow-builder",
  "implementationVersion": "4.0.0-beta.100",
  "reviewedAt": "2026-07-24",
  "entries": [
    {
      "requirementId": "BPMN-FOUNDATION-SEMANTIC-MODEL",
      "supportLevel": "modeled",
      "summary": "Strict versioned semantic IR for core processes, collaborations, activities, gateways, sequence flows, and events; this is not a modeling-profile claim.",
      "evidence": [
        {
          "kind": "source",
          "path": "src/BpmnModel.ts",
          "symbol": "BpmnModel"
        },
        {
          "kind": "schema-test",
          "path": "test/BpmnModel.test.ts",
          "testName": "admits a strict BPMN semantic document with collaborations, reusable event definitions, boundary events, and event subprocesses"
        }
      ]
    },
    {
      "requirementId": "BPMN-FOUNDATION-SEMANTIC-VALIDATION",
      "supportLevel": "modeled",
      "summary": "Hostile-input-safe aggregate validation covers identifiers, containment, references, flow scope, event contexts, and collaboration ownership.",
      "evidence": [
        {
          "kind": "source",
          "path": "src/BpmnModel.ts",
          "symbol": "validate"
        },
        {
          "kind": "schema-test",
          "path": "test/BpmnModel.test.ts",
          "testName": "aggregates participant, collaboration, boundary-event, event-subprocess, event-gateway, and sequence-scope diagnostics"
        }
      ]
    },
    {
      "requirementId": "BPMN-FOUNDATION-DURABLE-MARKING",
      "supportLevel": "state-modeled",
      "summary": "Durable scope, token, gateway, loop, call, wait, work-item, compensation, and cancellation state is represented and cross-validated.",
      "evidence": [
        {
          "kind": "source",
          "path": "src/BpmnExecutionState.ts",
          "symbol": "BpmnExecutionState"
        },
        {
          "kind": "state-test",
          "path": "test/BpmnExecutionState.test.ts",
          "testName": "admits a durable BPMN execution-state snapshot against a validated model"
        }
      ]
    },
    {
      "requirementId": "BPMN-FOUNDATION-EVIDENCE-GATES",
      "supportLevel": "modeled",
      "summary": "Coverage categories and formal-claim admission are strict, versioned, hostile-input safe, and machine checked.",
      "evidence": [
        {
          "kind": "source",
          "path": "src/BpmnConformance.ts",
          "symbol": "validate"
        },
        {
          "kind": "schema-test",
          "path": "test/BpmnConformance.test.ts",
          "testName": "rejects formal claims while the normative catalogue is incomplete"
        }
      ]
    },
    {
      "requirementId": "BPMN-EXECUTION-BASIC-TOKEN-KERNEL",
      "supportLevel": "executable",
      "summary": "A deliberately bounded executable subset covers root and embedded subprocess scopes, none start/end events, generic tasks, normal/conditional/default sequence flows, exclusive routing, parallel split/join epochs, and Standard Loops on generic Tasks. Standard Loop execution persists exact iteration and condition evidence, honors pre-test or post-test behavior, and enforces a mandatory positive loopMaximum. Combined pre/post-test loops, SubProcess loops, arbitrary cycles, and multi-instance activities are rejected. Deterministic journals and causal replay cover the admitted subset.",
      "evidence": [
        {
          "kind": "source",
          "path": "src/BpmnKernel.ts",
          "symbol": "TransitionJournal"
        },
        {
          "kind": "transition-test",
          "path": "test/BpmnKernel.test.ts",
          "testName": "splits and joins parallel branches with exact join epochs"
        },
        {
          "kind": "replay-test",
          "path": "test/BpmnKernel.test.ts",
          "testName": "replays an ordered transition journal into the exact durable marking"
        },
        {
          "kind": "transition-test",
          "path": "test/BpmnKernel.test.ts",
          "testName": "executes test-after at least once and enforces loopMaximum without another evaluation"
        },
        {
          "kind": "replay-test",
          "path": "test/BpmnKernel.test.ts",
          "testName": "persists exact test-before iterations, replays them, and makes old completion idempotent"
        }
      ]
    },
    {
      "requirementId": "BPMN-EXECUTION-TASK-BOUNDARY-ERROR-SLICE",
      "supportLevel": "executable",
      "summary": "A fingerprinted protocol-v3 binding admits exact durable Task success or business-failure outcomes. A native Effect Workflow bridge checks that binding before dispatch and translates one raw managed-retry result into a portable resolution command without rerunning the handler. Only a compiled exact failure-identity mapping promotes a failure to a BPMN Error; one matching interrupting Boundary Error catches it, while unmapped or uncaught failures deterministically fail the root execution. Operational timeout, defects, and interruption remain outside Error routing. Resolution idempotency and causal journal replay are enforced. The complete Activity lifecycle and wider event catalogue remain unsupported.",
      "evidence": [
        {
          "kind": "source",
          "path": "src/BpmnActivityV3.ts",
          "symbol": "TaskBinding"
        },
        {
          "kind": "source",
          "path": "src/BpmnKernel.ts",
          "symbol": "resolveTask"
        },
        {
          "kind": "source",
          "path": "src/EffectWorkflowBpmnV3.ts",
          "symbol": "executeTask"
        },
        {
          "kind": "transition-test",
          "path": "test/EffectWorkflowRetryV3.test.ts",
          "testName": "executes once, retains the raw success, and resolves and replays the exact BPMN Task"
        },
        {
          "kind": "transition-test",
          "path": "test/EffectWorkflowRetryV3.test.ts",
          "testName": "promotes an exact policy override into the mapped interrupting Boundary Error"
        },
        {
          "kind": "transition-test",
          "path": "test/EffectWorkflowRetryV3.test.ts",
          "testName": "preserves an exhausted retry explanation in the BPMN business-failure command"
        },
        {
          "kind": "transition-test",
          "path": "test/BpmnKernel.test.ts",
          "testName": "catches an exactly mapped business failure at one interrupting Boundary Error and replays it"
        },
        {
          "kind": "transition-test",
          "path": "test/BpmnKernel.test.ts",
          "testName": "keeps an unmapped business failure terminal even when the Boundary Error is catch-all"
        },
        {
          "kind": "replay-test",
          "path": "test/BpmnKernel.test.ts",
          "testName": "fails a mapped but uncaught BPMN Error and keeps near-match error codes unmapped"
        },
        {
          "kind": "replay-test",
          "path": "test/BpmnKernel.test.ts",
          "testName": "resolves a protocol-v3-bound task success and replays the exact durable outcome"
        }
      ]
    },
    {
      "requirementId": "BPMN-EXECUTION-CORE-PROCESS-XML-SLICE",
      "supportLevel": "executable",
      "summary": "A strict facade composes named profile bpmn-2.0.2-core-process-di-v3 with the bounded token kernel without projection or inference. The intersection includes conditional/default routing, parallel split/join, ordinary subprocesses, and the bounded generic-Task Standard Loop subset with version-bound formal conditions and mandatory loopMaximum. Explicit external taskBindings may be supplied through CompileXmlOptions and are fingerprinted; they are not read from BPMN XML. Exact journal replay, canonical export, re-import, recompilation, and replay equivalence remain part of the boundary.",
      "evidence": [
        {
          "kind": "source",
          "path": "src/BpmnExecutable.ts",
          "symbol": "compileXml"
        },
        {
          "kind": "transition-test",
          "path": "test/BpmnExecutable.test.ts",
          "testName": "round-trips and replays the executable XML subset through its conditional branch"
        },
        {
          "kind": "replay-test",
          "path": "test/BpmnExecutable.test.ts",
          "testName": "round-trips and replays the executable XML subset through its conditional branch"
        },
        {
          "kind": "roundtrip-test",
          "path": "test/BpmnExecutable.test.ts",
          "testName": "round-trips and replays the executable XML subset through its conditional branch"
        },
        {
          "kind": "transition-test",
          "path": "test/BpmnExecutable.test.ts",
          "testName": "imports, binds, executes, and replays a bounded Standard Loop through the Effect runtime"
        },
        {
          "kind": "replay-test",
          "path": "test/BpmnExecutable.test.ts",
          "testName": "imports, binds, executes, and replays a bounded Standard Loop through the Effect runtime"
        },
        {
          "kind": "roundtrip-test",
          "path": "test/BpmnExecutable.test.ts",
          "testName": "imports, binds, executes, and replays a bounded Standard Loop through the Effect runtime"
        }
      ]
    },
    {
      "requirementId": "BPMN-INTERCHANGE-BOUNDED-XML-INFOSET",
      "supportLevel": "modeled",
      "summary": "A strict, resource-bounded, namespace-aware XML 1.0 infoset model parses, validates, and serializes ordered XML content with lexical source spans. This modeled foundation is not BPMN semantic mapping, normative XSD validation, DI interchange, or a BPMN interchange/conformance claim.",
      "evidence": [
        {
          "kind": "source",
          "path": "src/BpmnXmlAst.ts",
          "symbol": "validate"
        },
        {
          "kind": "schema-test",
          "path": "test/BpmnXmlAst.test.ts",